<?xml version="1.0" encoding="utf-8"?>
<xs:schema xmlns:xs="http://www.w3.org/2001/XMLSchema"
    version="0.1" xml:lang="es">
    <xs:annotation>
        <xs:documentation xml:lang="Es-es">
            Esquema para el alta de clientes sede central
            <fecha>2022-01-25</fecha>
            <autor>Ruben MejÃ­as Zapata</autor>
        </xs:documentation>
    </xs:annotation>
	<xs:element name="clientes">
		<xs:complexType>
			<xs:sequence minOccurs="1" maxOccurs="unbounded">
				<xs:element name="sede" minOccurs="1">
                    <xs:complexType>
                        <xs:sequence>
                            <xs:element minOccurs="0" maxOccurs="unbounded" name="direccion" type="xs:string" />
                            <xs:element name="empleado" type="xs:string" />
                            <xs:element name="fecha_Alta" type="xs:date" />
                            <xs:element name="descripcion" minOccurs="0">
                                <xs:simpleType>
                                    <xs:restriction base="xs:string">
                                        <xs:enumeration value="Trabajador"/>
                                        <xs:enumeration value="No Trabajador"/>
                                    </xs:restriction>
                                </xs:simpleType>
                            </xs:element>
                            <xs:element name="cliente" minOccurs="1" maxOccurs="unbounded">
                                <xs:complexType>
                                    <xs:sequence>
                                        <xs:element name="numViviendas" type="xs:positiveInteger" />
                                        <xs:element name="costeVivienda" type="xs:decimal" />
                                        <xs:element name="resumenViviendas" type="xs:string" />
                                        <xs:element name="plazoAlta" type="xs:date" />
                                    </xs:sequence>
                                    <xs:attribute name="codigo" use="required">
                                        <xs:simpleType>
                                            <xs:restriction base="xs:string">
                                                <xs:pattern value="[A-Z]{1}[0-9]{8}"/>
                                            </xs:restriction>
                                        </xs:simpleType>
                                    </xs:attribute>
                                </xs:complexType>
                            </xs:element>
                        </xs:sequence>
                        <xs:attribute name="codigo" type="codigoCliente" use="required" />
                    </xs:complexType>
                </xs:element>
			</xs:sequence>
		</xs:complexType>
	</xs:element>
    <xs:simpleType name="codigoCliente">
        <xs:restriction base="xs:string">
            <xs:pattern value="[A-Z]{1}[0-9]{8}"/>
        </xs:restriction>
    </xs:simpleType>
</xs:schema>